game_id,name,rating_ratio,price,genre,tags
1118200,People Playground,69.845,999,"Action, Casual, Indie, Simulation","Sandbox, Gore, Physics, Blood, Moddable, Violent, 2D, Singleplayer, Destruction, Simulation, Funny, Building, Pixel Graphics, Psychological Horror, Indie, Action, Casual, Comedy, Horror, Choose Your Own Adventure"
268910,Cuphead,26.175,1999,"Action, Indie","Difficult, Cartoon, Co-op, Platformer, Great Soundtrack, Local Co-Op, 2D, Hand-drawn, Multiplayer, Indie, Retro, Cartoony, Bullet Hell, Action, Shoot 'Em Up, Singleplayer, Side Scroller, Colorful, Funny, Souls-like"
397900,Business Tour - Board Game with Online Multiplayer,1.548,0,"Adventure, Casual, Indie, Massively Multiplayer, Simulation, Strategy, Free To Play","Board Game, Free to Play, Multiplayer, Strategy, Casual, Massively Multiplayer, Indie, Co-op, Capitalism, Online Co-Op, Funny, Management, Family Friendly, Adventure, Singleplayer, Trading, Simulation, Tabletop, Psychological Horror, Comedy"
435150,Divinity: Original Sin 2 - Definitive Edition,23.006,4499,"Adventure, RPG, Strategy","Tactical RPG, RPG, Turn-Based Strategy, Story Rich, Fantasy, Character Customization, CRPG, Exploration, Party-Based RPG, Strategy RPG, PvP, Female Protagonist, Co-op Campaign, Local Co-Op, Choices Matter, Isometric, Romance, Strategy, Moddable, Funny"
698780,Doki Doki Literature Club!,27.265,0,"Casual, Free To Play, Indie","Psychological Horror, Visual Novel, Anime, Free to Play, Dating Sim, Horror, Cute, Dark, Story Rich, Romance, Singleplayer, Great Soundtrack, Gore, Violent, Indie, Sexual Content, First-Person, Memes, Casual, Adventure"
1237970,Titanfall 2,20.83,2999,Action,"FPS, Mechs, Multiplayer, Shooter, Singleplayer, Action, Parkour, Sci-fi, First-Person, Futuristic, PvP, Combat, Military, Fast-Paced, Team-Based, Time Travel, Hero Shooter, Violent, Co-op, Gore"
863550,HITMAN 2,10.091,0,Action,"Stealth, Assassin, Action, Singleplayer, Third Person, Multiplayer, Violent, Open World, Sandbox, Strategy, Puzzle, Gore, Shooter, Atmospheric, Third-Person Shooter, Co-op, Funny, Online Co-Op, Great Soundtrack, Nudity"
273110,Counter-Strike Nexon: Studio,1.981,0,"Action, Casual, Indie, Massively Multiplayer, Free To Play","Free to Play, FPS, Zombies, Sandbox, PvE, PvP, Multiplayer, Shooter, Horror, Action, Co-op, First-Person, Survival Horror, Online Co-Op, Gore, Funny, Mod, 3D, Dark, Singleplayer"
555570,Infestation: The New Z,1.164,0,"Action, Indie, Massively Multiplayer, RPG, Free To Play","Zombies, Free to Play, Survival, Multiplayer, Open World, Massively Multiplayer, FPS, Shooter, Action, PvP, Co-op, Survival Horror, RPG, Adventure, Violent, Horror, Third-Person Shooter, PvE, Indie, Walking Simulator"
868270,The Cycle,1.739,0,"Action, Free To Play, Massively Multiplayer","Extraction Shooter, Survival, Loot, Free to Play, Multiplayer, Crafting, Looter Shooter, Shooter, Tactical, PvP, First-Person, FPS, Exploration, PvE, Sci-fi, Aliens, Online Co-Op, Competitive, Adventure, Battle Royale"
1593500,God of War,24.173,4999,"Action, Adventure, RPG","Action, Singleplayer, Story Rich, Adventure, Mythology, Combat, Third Person, RPG, Hack and Slash, Violent, Open World, Fantasy, Exploration, Atmospheric, Gore, Action RPG, Souls-like, Emotional, 3D, PvE"
782330,DOOM Eternal,10.284,3999,Action,"FPS, Action, Gore, Great Soundtrack, Fast-Paced, Violent, Demons, Shooter, First-Person, Singleplayer, Blood, Multiplayer, Sci-fi, Post-apocalyptic, Mature, Atmospheric, Story Rich, Difficult, Adventure, Horror"
360,Half-Life Deathmatch: Source,2.949,999,Action,"Action, FPS, Multiplayer, Shooter, Sci-fi, First-Person, Classic, Remake, Violent, Adventure, Competitive, Fast-Paced, Singleplayer, Atmospheric, Horror, Gore, Great Soundtrack, Retro, Arena Shooter"
2195250,EA SPORTS FC 24,1.361,6999,"Simulation, Sports","Football (Soccer), Sports, Controller, Multiplayer, PvP, e-sports, Competitive, PvE, Local Multiplayer, 3D, Simulation, Online Co-Op, Singleplayer, Local Co-Op, Realistic, Co-op, Family Friendly, Action, First-Person, Early Access"
391540,Undertale,29.452,999,"Indie, RPG","Great Soundtrack, Story Rich, Choices Matter, Multiple Endings, Pixel Graphics, Funny, RPG, Singleplayer, Indie, Comedy, 2D, Replay Value, Bullet Hell, Cute, Memes, Retro, Dark, Psychological Horror, Dating Sim, Horror"
294100,RimWorld,48.331,2799,"Indie, Simulation, Strategy","Colony Sim, Base-Building, Survival, Strategy, Sandbox, Management, Building, Simulation, Singleplayer, Moddable, City Builder, Open World, Procedural Generation, 2D, Sci-fi, Indie, Space, Tactical RPG, Cartoony, Western"
548430,Deep Rock Galactic,35.521,2999,Action,"Dwarf, Co-op, PvE, FPS, Procedural Generation, Class-Based, Shooter, Exploration, First-Person, Loot, Sci-fi, Space, Action, Atmospheric, Looter Shooter, Combat, Survival, Horror, Dark, Action Roguelike"
223470,POSTAL 2,30.629,999,"Action, Adventure, Indie","Violent, Dark Humor, Open World, Mature, First-Person, Funny, Comedy, Sandbox, Moddable, Third Person, Gore, FPS, Action, Dark Comedy, Multiplayer, Singleplayer, Shooter, Classic, Adventure, Satire"
766570,Russian Fishing 4,1.126,0,"Adventure, Casual, Massively Multiplayer, RPG, Simulation, Sports, Free To Play","Fishing, Free to Play, Multiplayer, Simulation, Nature, Realistic, Relaxing, Crafting, First-Person, Immersive Sim, Sports, Atmospheric, Singleplayer, Open World, Survival, Massively Multiplayer, Casual, Adventure, RPG, Family Friendly"
241930,Middle-earth: Shadow of Mordor,12.184,1999,,"Open World, Action, Fantasy, Adventure, Third Person, Stealth, Singleplayer, RPG, Action RPG, Assassin, Hack and Slash, Gore, Parkour, Story Rich, Atmospheric, Dark Fantasy, Magic, Lore-Rich, Based On A Novel, Sandbox"
1332010,Stray,35.588,2999,"Adventure, Indie","Cats, Adventure, Atmospheric, Cyberpunk, Singleplayer, Cute, Exploration, Robots, Beautiful, Puzzle, Third Person, Horror, Sci-fi, Indie, Dystopian , Open World, Mystery, Action, Colorful, Stealth"
1551360,Forza Horizon 5,7.785,5999,"Action, Adventure, Racing, Simulation, Sports","Racing, Open World, Driving, Multiplayer, Automobile Sim, Realistic, Simulation, Adventure, Arcade, Exploration, First-Person, Co-op, Sports, Online Co-Op, PvP, Atmospheric, Singleplayer, Beautiful, VR, Action"
